{
  "relationshipID": "CDR-008",
  "sourceDomain": "Compliance",
  "targetDomain": "valueStream",
  "relationshipType": "audits",
  "description": "Compliance function audits customer onboarding value stream for regulatory adherence",
  "metadata": {
    "priority": "critical",
    "impactArea": "regulatory",
    "frequency": "quarterly",
    "strength": 5
  }
}
